<?xml version="1.0" encoding="UTF-8" standalone="yes"?>
<sdk xmlns:xsi="http://www.w3.org/2001/XMLSchema-instance"
     xsi:schemaLocation="https://github.com/macomfan/cei https://github.com/macomfan/cei/ceisdk.xsd"
     xmlns="https://github.com/macomfan/cei"
     name="huobipro">
    <models>
        <model name="Candlestick">
            <string name="status"/>
            <object_array name="data" refer="CandlestickData"/>
        </model>

        <model name="CandlestickData">
            <int name="id"/>
            <decimal name="amount"/>
            <int name="count"/>
            <decimal name="open"/>
            <decimal name="close"/>
            <decimal name="low"/>
            <decimal name="high"/>
            <decimal name="vol"/>
        </model>
    </models>
</sdk>