<?xml version="1.0" encoding="UTF-8"?>
<sdk xmlns:xsi="http://www.w3.org/2001/XMLSchema-instance"
	 xsi:schemaLocation="https://github.com/macomfan/cei https://github.com/macomfan/cei/ceisdk.xsd"
	 xmlns="https://github.com/macomfan/cei"
	 name="binance">
	<restful name="MarketClient">
		<interface name="getDepth">
			<inputs>
				<string name="symbol"/>
				<int name="limit"/>
			</inputs>
			<request method="get" target="/api/v3/depth">
				<query_strings>
					<query key="symbol" value="{symbol}"/>
					<query key="limit" value="{limit}"/>
				</query_strings>
			</request>
			<response model="Depth">
				<json_parser>
					<json_value copy="lastUpdateId"/>
					<json_object_array copy="bids" model="DepthEntity">
						<json_value key="\[0]" value="{price}"/>
						<json_value key="\[1]" value="{qty}"/>
					</json_object_array>
					<json_object_array copy="asks" model="DepthEntity">
						<json_value key="\[0]" value="{price}"/>
						<json_value key="\[1]" value="{qty}"/>
					</json_object_array>
				</json_parser>
			</response>
		</interface>
	</restful>
</sdk>