<?xml version="1.0" encoding="UTF-8"?>
<sdk xmlns:xsi="http://www.w3.org/2001/XMLSchema-instance"
     xsi:schemaLocation="https://github.com/macomfan/cei https://github.com/macomfan/cei/ceisdk.xsd"
     xmlns="https://github.com/macomfan/cei"
     name="binance">
    <clients>
        <restful name="MarketClient">
            <interfaces>
                <interface name="getAggregateTrades">
                    <inputs>
                        <string name="symbol"/>
                        <int name="fromId"/>
                        <int name="startTime"/>
                        <int name="endTime"/>
                        <int name="limit"/>
                    </inputs>
                    <request method="get" target="/api/v3/aggTrades">
                        <query_strings>
                            <query key="symbol" value="{symbol}"/>
                            <query key="fromId" value="{fromId}"/>
                            <query key="startTime" value="{startTime}"/>
                            <query key="startTime" value="{endTime}"/>
                            <query key="limit" value="{limit}"/>
                        </query_strings>
                    </request>
                    <response>
                        <json_parser model="AggregateTradeList">
                            <json_object_array value="{data}" model="AggregateTrade">
                                <json_value key="a" value="{id}"/>
                                <json_value key="p" value="{price}"/>
                                <json_value key="q" value="{qty}"/>
                                <json_value key="f" value="{firstTradeId}"/>
                                <json_value key="l" value="{lastTradeId}"/>
                                <json_value key="T" value="{timestamp}"/>
                                <json_value key="m" value="{isBuyerMaker}"/>
                                <json_value key="M" value="{isBestMatch}"/>
                            </json_object_array>
                        </json_parser>
                    </response>
                </interface>
            </interfaces>
        </restful>
    </clients>

</sdk>