<?xml version="1.0" encoding="UTF-8"?>
<sdk xmlns:xsi="http://www.w3.org/2001/XMLSchema-instance"
     xsi:schemaLocation="https://github.com/macomfan/cei https://github.com/macomfan/cei/ceisdk.xsd"
     xmlns="https://github.com/macomfan/cei"
     name="binance">
	<model name="Trade">
		<int name="id"/>
		<decimal name="price"/>
		<decimal name="qty"/>
		<decimal name="quoteQty"/>
		<int name="time"/>
		<boolean name="isBuyerMaker"/>
		<boolean name="isBestMatch"/>
	</model>
</sdk>