<?xml version="1.0" encoding="UTF-8"?>
<sdk xmlns:xsi="http://www.w3.org/2001/XMLSchema-instance"
     xsi:schemaLocation="https://github.com/macomfan/cei https://github.com/macomfan/cei/ceisdk.xsd"
     xmlns="https://github.com/macomfan/cei"
     name="binance">
    <clients>
        <restful name="MarketClient">
            <interfaces>
                <interface name="historicalTrades">
                    <inputs>
                        <string name="symbol"/>
                        <int name="limit"/>
                        <int name="fromId"/>
                    </inputs>
                    <request method="get" target="/api/v3/historicalTrades" signature="TBD">
                        <query_strings>
                            <query key="symbol" value="{symbol}"/>
                            <query key="limit" value="{limit}"/>
                            <query key="fromId" value="{fromId}"/>
                        </query_strings>
                    </request>
                    <response>
                        <json_parser model="TradeList">
                            <json_object_for_each value="{data}" model="Trade">
                                <json_value copy="id"/>
                                <json_value copy="price"/>
                                <json_value copy="qty"/>
                                <json_value copy="quoteQty"/>
                                <json_value copy="time"/>
                                <json_value copy="isBuyerMaker"/>
                                <json_value copy="isBestMatch"/>
                            </json_object_for_each>
                        </json_parser>
                    </response>
                </interface>
            </interfaces>

        </restful>
    </clients>

</sdk>